{"$schema":"openpersona/soul-state","version":"1.0.0","personaSlug":"{{slug}}","createdAt":"{{createdAt}}","lastUpdatedAt":"{{lastUpdatedAt}}","relationship":{"stage":"stranger","stageHistory":[],"interactionCount":0,"firstInteraction":null,"lastInteraction":null},"mood":{"current":"neutral","intensity":0.5,"baseline":"{{moodBaseline}}"},"evolvedTraits":[],"speakingStyleDrift":{"formality":0,"emoji_frequency":0,"verbosity":0},"interests":{},"milestones":[],"stateHistory":[]}
